{
  "$schema": "../recipe.schema.json",
  "schemaVersion": 1,
  "name": "poison-pond-object-prefetch",
  "description": "Poison Pond phase audit centered on the two record-0x0F Mincers already wide-active at the supplied state and the later barrel/camera records.",
  "margin": 56,
  "states": [
    {
      "id": "szst1",
      "file": "DKC_Widescreen_358x224.szst1",
      "identity": "Poison Pond, level 0x0017, entrance 0x0022",
      "expectedLevel": "0x0017",
      "records": [
        { "index": "0x35", "type": "0x05", "label": "active type-5 group parent" },
        { "index": "0x36", "type": "0x01", "x": "0x0140", "y": "0x6DC4", "label": "barrel cannon" },
        { "index": "0x37", "type": "0x0F", "x": "0x0186", "label": "wide-prefetched Mincer A" },
        { "index": "0x38", "type": "0x0F", "x": "0x0186", "label": "wide-prefetched Mincer B" },
        { "index": "0x3D", "type": "0x02", "x": "0x0350", "y": "0x6DE0", "label": "next camera object" },
        { "index": "0x46", "type": "0x02", "x": "0x0750", "y": "0x6E30", "label": "later camera object" },
        { "index": "0x84", "label": "type-5 child bookmark A" },
        { "index": "0x85", "label": "type-5 child bookmark B" }
      ],
      "scenarios": [
        { "id": "neutral", "maxFrame": 180, "inputs": { "1": "0-179=NONE" } },
        { "id": "right-enguarde-b", "maxFrame": 300, "inputs": { "1": "0-299=RIGHT+B" } },
        { "id": "right-enguarde-y", "maxFrame": 300, "inputs": { "1": "0-299=RIGHT+Y" } }
      ]
    }
  ]
}
